message_timestamp,user_name,topic_name,message_text,channel,thread_ts,topic_description,topic_id,user_id,processed_at
1701274543.350049,Abdurrahman,Stripe Elements and Checkout Flow Enhancements,"<@U059AC59LLF>, we were investigating how could we use <https://stripe.com/en-gb-us/payments/checkout|Stripe checkout> page instead of re-creating custom checkout pages (both for <https://www.stackedmarketer.com/sm-pro-7-trial-for-7-days/|normal> and <https://www.stackedmarketer.com/register/extra-14-day-trail-19/|extended> trial version of subscription)

But I have come across 2 issues:

1. <https://docs.memberpress.com/article/35-stripe|Memberpress' Stripe integration page> says “Stripe Checkout is not fully compatible with a multi-site setup in WordPress. *If you are using multi-site, we recommend you use Stripe Elements*.” 
    a. We need to validate whether SM is a multi-site or not.
2. Current checkout pages (both <https://www.stackedmarketer.com/sm-pro-7-trial-for-7-days/|normal> and <https://www.stackedmarketer.com/register/extra-14-day-trail-19/|extended>) are also *account creation* pages, where users are asked to enter _*username*_ and _*password*_ in addition to standart checkout data (e-mail, address and payment detail).
    a. I am not sure Stripe checkout supports these fields, will check
    b. Even if it supports and shares it with Memberpress to create new users, is it safe to share password with Stripe ? ",refact-stackedmarketer,,"Discussion on implementing Stripe Elements and Checkout flow enhancements, including address autofill and business checkbox visibility for all customers. Focus on improving user experience and maintaining current payment structure.",78a4a2f7-5e8d-40d3-9467-be279917d52a,U05R8DF8EJE,2025-12-11T22:08:51.525Z
1705479594.504259,Parnia,Mobile Email Template - Branding and QA Finalization,"Thank you Manu for the explanation.
I've shared your message with the team and we are looking into it.",refact-stackedmarketer,,Finalizing the mobile email template to align with new branding changes and conducting QA using Litmus for Stacked Marketer emails.,f1468d41-0e7e-41db-ac61-4bd0aa6351df,U039WK9NWA0,2025-12-11T21:11:19.653Z
1702052070.474119,Manu,AutoPub - New Bug Report October 2023,"Hi <@U039WK9NWA0>, as I mentioned, we also have a request for 2 AutoPub updates:
• *Feature:* Add The Crew’s Insights to WordPress when using AutoPub with the Stacked Marketer template (as drafts, so same as other posts).
• *Bug fix:* PoM missing first letter when linking sometimes, seems only in ClickWorthy section. This is the document, in case we might have made a mistake and used an older version: <https://docs.google.com/document/d/15zXBwVlVvdUMKvP4MCFb7vLdIvAllpJULjHM4F-cN5g/edit?usp=sharing>",refact-stackedmarketer,1702052070.474119,A new bug report for AutoPub has been submitted. Details are provided in the linked document for further investigation.,77bd55f7-52c0-44c5-8d09-e870054fa853,U059AC59LLF,2025-12-11T22:12:15.39Z
1704835720.136769,Manu,UTM Content Parameter Standardization,We could even pass the URL in utm_content perhaps?,refact-stackedmarketer,,Discussion on standardizing the use of utm_content parameters to improve tracking and personalization in user sign-up flows.,998a15d5-9d9f-4040-bef5-a08b98758910,U059AC59LLF,2025-12-11T21:09:14.499Z
1704298935.740329,Manu,Appreciation for Dev Team,"Thinking many here appreciate it, especially the dev team haha :joy:",refact-stackedmarketer,1704298935.740329,Messages expressing appreciation and gratitude towards the development team for their efforts and contributions.,0ab88113-dc13-4939-bca5-2a907b08d006,U059AC59LLF,2025-12-11T21:07:07.56Z
1701822265.536059,Parnia,"Sprint Planning - Article and Newsletter Refactor, SM Pro Onboarding and Design","Hey <@U059AC59LLF>
Sharing the documents I presented on our meeting here:

<https://docs.google.com/spreadsheets/d/1vr4_7up-5olKK2ArI0oixKgMXOtA9qLT1SJYjAT592A/edit?usp=sharing|SM &amp; SM pro timeline>
<https://docs.google.com/spreadsheets/d/1mAspfhsmUFCbTKOSESJHVoZT4ztBf1reMSVkz9FLZN4/edit#gid=461960755|Next sprint's plan>",refact-stackedmarketer,,"Draft plan for the upcoming sprint focusing on refactoring article and newsletter pages, and designing SM Pro onboarding and homepage.",dd37cfe7-64ad-47b2-8901-066d3407a094,U039WK9NWA0,2025-12-11T22:11:27.56Z
1704835749.100689,Manu,UTM Content Parameter Standardization,"You can let us know what is best. Full URL is too much but maybe we can do the slug, so the final part of the url in UTM content?",refact-stackedmarketer,,Discussion on standardizing the use of utm_content parameters to improve tracking and personalization in user sign-up flows.,998a15d5-9d9f-4040-bef5-a08b98758910,U059AC59LLF,2025-12-11T21:09:22.18Z
1710428603.808619,Manu,Feature Image Clarity Issues in New Design Rollout,"Looks great. We will have a closer look today but one thing to clarify, <@U039WK9NWA0> - The blurred images in the feature image section is sitll an issue that hasn’t been fixed, right? As mentioned, sometimes it’s OK but it’s probably just because the content was loaded fully when visiting the link. On a new device, we still see feature images are blury/downscaled.",refact-stackedmarketer,1710428603.808619,"Ongoing issues with blurred or downscaled feature images in the new design rollout, particularly on new devices. Discussion includes potential causes and solutions to ensure image clarity.",f7c283b0-25ba-4aae-bef8-1255448193e8,U059AC59LLF,2025-12-11T21:36:32.78Z
1715587557.938139,Parnia,SM Custom Blocks - Video Overview,"Hey <@U059AC59LLF>
<https://www.loom.com/share/ab9979e57c5e4d168640de31258000d0?sid=8d5aef8d-1f09-4be6-a85d-9602185c6c76|Here >is a video on the 4 SM custom blocks that can be used for posts, reports and etc.
• *SM Video*
• *SM Gallery*
• *SM Key Points*
• *SM Unfold Content*.",refact-stackedmarketer,1715587557.938139,"Introduction and overview of the new SM custom blocks including SM Video, SM Gallery, SM Key Points, and SM Unfold Content, as demonstrated in the provided video.",a2c63a1d-ccc1-4a80-8fa0-eacbe5819084,U039WK9NWA0,2025-12-11T20:25:45.499Z
1711262137.749299,Manu,General Availability Update,"Hey everyone, I’m around if needed, just letting you know.",refact-stackedmarketer,,General status update indicating user availability without specific task or issue.,b0da608b-fce7-411f-97bf-dfa05ea594ef,U059AC59LLF,2025-12-11T21:39:02.003Z
1701215040.331539,Parnia,Sprint Recap and Planning [Nov 13th - Dec 10th],"<@U059AC59LLF>
Here is a quick recap of what we worked on in the previous sprint *[Nov 13th - 26th]*:

• SM pro scope definition *[in progress]*
• Design: SM New Style Guide :white_check_mark:
• Design: Article Archive :white_check_mark:
• Design: Single Article :white_check_mark:
• Upgrade to PHP 8.2 :white_check_mark:
• Design: update the email template with the new branding :white_check_mark:
• Design: Update Homepage based on new branding :white_check_mark:
• Autopub bug - sponsor logo :white_check_mark:
• Implement SM new style guide :white_check_mark:
• Design: Pro Landing page *[in progress]*
Our tasks for the current sprint *[Nov 27th - Dec 10th]* are:

• [Dev] Custom plugin to remove Zapier from the flow
• [Dev] Article archive and single article page refactor
• [Dev] Newsletter archive and full newsletter page refactor
• [Design] SM pro Landing Page
• [Design] SM pro Onboarding
• [Design] SM newsletter signup Landing page
• [Design] Tactics newsletter signup Landing page
• [Design] PoM newsletter signup Landing page",refact-stackedmarketer,,"Summary of tasks completed in the previous sprint (Nov 13th - 26th) and planned tasks for the current sprint (Nov 27th - Dec 10th), covering design updates, PHP 8.2 upgrade, and development tasks including Zapier removal and newsletter refactor.",4a473026-1f22-41a8-9d9d-e32c2f544e58,U039WK9NWA0,2025-12-11T22:08:39.376Z
1697553713.511409,Parnia,AutoPub - Document Link Request for Automation Tab Issue,"<@U059AC59LLF>
Can you please provide us with the link to the document where the AutoPub issue occurred?",refact-stackedmarketer,,"Request for document link where the AutoPub Automation Tab Visibility Issue occurred, to aid in investigation.",c8de3694-4f80-4858-aa37-f2cd6a9936fa,U039WK9NWA0,2025-12-11T21:58:31.45Z
1707141815.019859,Manu,SM Content Space - WordPress Category Management and Implementation,"I think then we should go with Option 2, and it should be relatively easy to implement it in the categories section of WordPress",refact-stackedmarketer,,"Discussion and implementation strategies for managing WordPress categories, including restructuring and switching parent categories without deletion.",85bad532-63be-4342-aa9a-761279f660ca,U059AC59LLF,2025-12-11T21:20:09.953Z
1704902755.361299,Manu,SM Pro - Landing Page Video Content Strategy,"1. _Keeping 3&amp;4. But should we design a dynamic flow based on different Landing Pages?_
I don’t think we need a dynamic flow for now. The Landing Page will contain the email field to start the process, then it goes to the signup and checkout flow we just recently reviewed on Figma. I think for now, this is the best way to start. We can do more experiments once we have traffic and conversions flowing regularly.",refact-stackedmarketer,,"Discussion on strategies for designing landing pages and incorporating video content for SM Pro, including decisions on dynamic flows and initial implementation strategies.",865b2de5-ace0-462d-b447-22ba2e6e81e0,U059AC59LLF,2025-12-11T21:09:45.98Z
1700532121.844989,Abdurrahman,Channel Join Notifications,<@U05R8DF8EJE> has joined the channel,refact-stackedmarketer,,Track notifications of users joining the channel for administrative purposes.,4ee3eb00-d716-4fe4-8a9f-f0e22527f611,U05R8DF8EJE,2025-12-11T22:06:08.442Z
1709716797.481929,Manu,AutoPub - Image Uploading Error with New Version,"If there’s some kind of event log for 9:50 am (CET) to 9:55 am, it could show more of what happened with AutoPub. From what I can see now, it works again but the fact that it tries to reuse images even if it’s a new document is probably not ideal. Every new doc should be treated as unique, including images in it, right?",refact-stackedmarketer,,"Investigate the issue in AutoPub where the wrong images are uploaded, occurring sporadically with the newest version. This may be related to caching problems that prevent image updates.",4a90b19e-eacd-4972-ae98-834f8b75c7c4,U059AC59LLF,2025-12-11T21:31:32.477Z
1726506789.067089,Manu,Learning Hub Updates - Design and Development Progress,"Hi <@U039WK9NWA0>, I did some sorting here to get some estimates: <https://docs.google.com/spreadsheets/d/1mAspfhsmUFCbTKOSESJHVoZT4ztBf1reMSVkz9FLZN4/edit?gid=401178628#gid=401178628>

In short, adjusing the learning hub is somewhat higher priority, and then if there’s time left, social features/profiles that perhaps integrate well with a job board plugin are next that we’d like to implement.

For the Learning Hub adjustments, we’re not looking to reinvent it completely, so cutting some parts like <@U05R8DF8EJE> suggested, is OK. Same for the Tactics widget, it can be a “copy” of previous sections just with the new heading that explains it’s about tactics (not courses, not reports).",refact-stackedmarketer,,"Comprehensive updates on the Learning Hub, including design and development progress. Covers new widget additions, navigation updates, and upcoming tasks for implementation.",49576b27-8bd0-4e0c-bab4-9d9adca009d8,U059AC59LLF,2025-12-11T20:36:55.974Z
1701207129.556979,Ali,User Join Notifications,<@UR7DA7Y91> has joined the channel,refact-stackedmarketer,,"Notifications for users joining the Slack channel, indicating new members or returning participants.",4e34ee76-52b8-4485-b9d0-2d4e5fcd90fa,UR7DA7Y91,2025-12-11T22:08:19.126Z
1708624083.780819,Manu,Course Progress Segmentation Strategy in Campaign Monitor,"Hi <@U05R8DF8EJE>, is this for *any* course or a “per course” basis?

Also, for point 2), is it only if they are at 0%? Or do they stay in the “started but not finished course” until they reach 100%?",refact-stackedmarketer,1708624083.780819,"Discussion on segmenting users based on course enrollment and progress in Campaign Monitor, focusing on the limitations of filtering by specific progress values and the benefits of storing progress in a single field.",77f026f9-06e0-40bf-8685-3d2bafa04002,U059AC59LLF,2025-12-11T21:25:35.323Z
1691080795.298569,Parnia,Stacked Marketer - Email Template Design and Optimization Discussion,"Thank you Manu. :pray::skin-tone-2:
I'll share your explanation with the team and get back to you.",refact-stackedmarketer,,"Discussion on the design, coding, and optimization of Stacked Marketer email templates, including color management and template flexibility.",72db645f-1896-44a5-bcbd-fdae3597b094,U039WK9NWA0,2025-12-11T21:48:08.571Z
1727805977.081219,Manu,Learning Hub Updates - Design and Development Progress,We can focus just on the job board part,refact-stackedmarketer,,"Comprehensive updates on the Learning Hub, including design and development progress. Covers new widget additions, navigation updates, and upcoming tasks for implementation.",49576b27-8bd0-4e0c-bab4-9d9adca009d8,U059AC59LLF,2025-12-11T20:39:24.842Z
1709228439.364149,Manu,Refactored Website - Feedback Document Comments,"Hi <@U039WK9NWA0>, our feedback is in the doc: <https://docs.google.com/document/d/1qiINbHCfSx7UXm9-03sePvPVrRbYLo6fdCou08QGKzE/edit>

I created a second section called Copy Changes where I go through a few changes in the copy for the pages. We might still have some smaller adjustments for the copy, of course but that should get us ready for the next phase.",refact-stackedmarketer,1709228439.364149,Ensure comments are added to the feedback document for the refactored website to track new items and relay feedback to the team effectively.,05381bec-2af5-48c7-bb6e-d47679d5f1ed,U059AC59LLF,2025-12-11T21:28:42.442Z
1704835707.919969,Manu,UTM Content Parameter Standardization,"For the second question, we use utm_content=[something] often but we don’t have it standardized. We can do this though, so the ‘you signed up for [this content]’ can be done through utm_content=[this content] perhaps?",refact-stackedmarketer,,Discussion on standardizing the use of utm_content parameters to improve tracking and personalization in user sign-up flows.,998a15d5-9d9f-4040-bef5-a08b98758910,U059AC59LLF,2025-12-11T21:09:09.998Z
1690995641.988049,Manu,Stacked Marketer - Email Template Design and Optimization Discussion,"It’s generally fairly simple though, so if there’s any need to explain the structure to a coder or anything like that, happy to do it. I’ve coded most of it, just used a template someone on Fiverr did for us but was not as we asked, so then I went in and revamped it, just used the guy’s inbox specific snippets at the beginning of the HTML file.",refact-stackedmarketer,,"Discussion on the design, coding, and optimization of Stacked Marketer email templates, including color management and template flexibility.",72db645f-1896-44a5-bcbd-fdae3597b094,U059AC59LLF,2025-12-11T21:47:14.613Z
1705504721.301639,Manu,AutoPub - Image Uploading Error with New Version,"Hi <@U039WK9NWA0>,

We have an update request for AutoPub.

First one, there seems to be a bug with images sometimes, we’re not sure why but you can see the doc and the preview it generated for us here:

<https://docs.google.com/document/d/1F0fSNBfEf8VovqnA5ufxOAgZwonKysAesTef4lEMxkw/edit?usp=sharing>

<https://www.stackedmarketer.com/wp-content/plugins/workflow-automation//cm-templates/sm-manu-glitch-test.html>

What we found is that the SPONSORED BY INSENSE image caused it. When that was removed, or when we reuploaded the image, it worked.

So there might be some hidden formatting we’re not aware of. I couldn’t find anything in the HTML source from the preview though.

Second, regarding WordPress categories, there are TWO cases in which we don’t want to select the News category.
• For The Crew’s Insights, the News category shouldn’t be assigned.
• For Psychology of Marketing, the News category shouldn’t be assigned.
Let me know the feedback and rough timeline for this when you can.

Thanks!",refact-stackedmarketer,1705504721.301639,"Investigate the issue in AutoPub where the wrong images are uploaded, occurring sporadically with the newest version. This may be related to caching problems that prevent image updates.",4a90b19e-eacd-4972-ae98-834f8b75c7c4,U059AC59LLF,2025-12-11T21:14:48.342Z
1715064751.058699,Parnia,Meeting Rescheduling - 5:30pm Austria Time,"Hi <@U059AC59LLF>
Is it okay with you if we push our meeting today to 5:30pm Austria time, instead of 5pm?

CC: <@U05R8DF8EJE> <@U46P0EG4A>",refact-stackedmarketer,1715064751.058699,Discussion about rescheduling today's meeting to 5:30pm Austria time instead of 5pm.,7743dab3-1b90-4cdd-b857-285a7d25547e,U039WK9NWA0,2025-12-11T20:25:21.709Z
1690995459.401689,Parnia,Stacked Marketer - Email Template Design and Optimization Discussion,<@U059AC59LLF> Do you have Figma files for your current email template?,refact-stackedmarketer,,"Discussion on the design, coding, and optimization of Stacked Marketer email templates, including color management and template flexibility.",72db645f-1896-44a5-bcbd-fdae3597b094,U039WK9NWA0,2025-12-11T21:46:35.816Z
1744836450.397759,Manu,SM Pro - Team Account Sub-Account Management Link Redirect Issue,"<@U039WK9NWA0> We found a relatively important bug:

• When creating team accounts (so with the ability to invite sub-accounts) for our SM Pro membership, the link that usually goes to sub-account management now goes to job listings.
See image attached where I mean. If you use it for the user “bachen” you can see what happens. Not sure what the actual link should be or why the link now goes to the job board/job listings.",refact-stackedmarketer,1744836450.397759,Investigate and resolve the issue where the link for sub-account management in SM Pro team accounts redirects to job listings instead of the intended management page.,b890fe28-a874-43e0-b32d-034fb8fec1cc,U059AC59LLF,2025-12-11T20:53:40.634Z
1711374130.016119,Manu,SM Pro - Reset Password Bug for Users Without Active Subscription,"First more important potential bug reported, *reset password for SM Pro.*

It works to request the email but then the user clicks, they get the screen in the attached screenshot.

This is an existing user without an active subscription, so maybe there’s a lock on seeing the reset password form for those without an active subscription? <@U05R8DF8EJE> <@U039WK9NWA0>",refact-stackedmarketer,1711374130.016119,Investigate and resolve the issue where users without an active subscription cannot access the reset password form after requesting a reset email in SM Pro.,d8a7e9d5-f0ee-4f37-b7a3-bfae57f5ee54,U059AC59LLF,2025-12-11T19:59:20.361Z
1712154432.030369,Asghar,SM Pro - Caching Update Delay and Subscription Access Issues,"<@U059AC59LLF>
Regarding the issue you mentioned about displaying the cached content to newly subscribed users, we have added the following URLs to the list of excluded URLs for caching, in order to resolve the issue:

• https://www.stackedmarketer.com/sm-pro/(.*)
• https://www.stackedmarketer.com/account/(.*)
• https://www.stackedmarketer.com/login/(.*)
• https://www.stackedmarketer.com/register/(.*)
• https://www.stackedmarketer.com/mepr/(.*)
• https://www.stackedmarketer.com/unauthorized/(.*)
To address the problem with the coupon code being stuck in loading, we have also added ""admin-ajax.php"" to the exclusion rule.

You can find the mentioned settings in the image below.

Furthermore, to ensure that the staging-beta environment closely mirrors the production environment, we have enabled Cloudflare APO for the staging-beta environment.",refact-stackedmarketer,1712154432.030369,"Ongoing caching issue affecting SM Pro users, causing delays in content updates and access issues for subscribers. Clearing cache on Cloudflare and Breeze provides temporary relief but does not fully resolve the problem. Requires further investigation to improve user experience.",f08d3e63-0c78-4d31-b25e-cdebb6bd09e2,U05SL9R85PF,2025-12-11T20:04:10.404Z
1709715395.838569,Manu,AutoPub - JavaScript Error in Template Preview,"This time it creates a preview that looks like this, and throws an error for the template having JavaScript in it.",refact-stackedmarketer,,"Investigate the error occurring when creating a preview in AutoPub, which is caused by JavaScript in the template. This issue needs to be addressed to ensure smooth preview generation without errors.",080eec95-3b3a-470b-8829-57e67a710006,U059AC59LLF,2025-12-11T21:30:24.276Z
1705499375.840029,Manu,SM Pro - User Status and Abandoned Signup Email Issue,"The subscription status, as defined by the Paying Sub custom field can either be empty (non-existent so never was a sub), ACTIVE (so we know to send info only relevant to active subs), or CANCELED (so we know to send them things relevant to those who don’t have a paying sub, along with stuff that might bring them back",refact-stackedmarketer,,"Address the issue where the SM Pro list in CM is not correctly tagging users as ACTIVE or CANCELED, leading to all users receiving Abandoned Signup emails. Investigate how to pass user status information accurately and update the system accordingly.",0ecd163a-c457-42e6-9d93-f1d589fa4df5,U059AC59LLF,2025-12-11T21:14:22.649Z
1695672722.320689,Julien Tricheux,Branding Plan and Visual Identity Alignment,"Hi <@U059AC59LLF>

Thank you for your patience. We've took the time to realign internally and see how we could best tackle the branding plan while limiting the amount of hours we spend on it as branding can quickly become time-consuming.
Given that we're not reworking anything in depth but need to align the 4 identities, *I evaluate that for the branding an initial estimate to rework the whole system would take about 24 to 30hrs.*

The deliverables for that would be basically as discussed:
&gt; Updated and improved logos.
&gt; New modular and flexible visual identity (including color palette, visual art direction, typography, etc)
For further deliverables like social media templates, PPTs, etc I think we can account for another 12 to 20h but we can discuss those to see where your priorities lies.

This does not include any design work for the websites themselves.
Hopefully, aside from the style guides and components, we won't have too much rework.

I would probably want to spread that work over 2 sprints to give us room for other projects. Maybe a 3rd sprint for the last deliverable that are not pertaining to the website.

*For details:*
• *Logo explorations and alignment: 8h*
• *Core branding and VI Component design: 10h*
• *Alignment and exploration to ensure consistency: 4h*
• *Expanded Art Direction: 4h*
*Let me know if you have any questions*

*CC <@U46P0EG4A>* *<@U039WK9NWA0>* ",refact-stackedmarketer,,"Discussion and planning for aligning the branding plan across four identities, including deliverables such as updated logos and a new visual identity. Estimated time allocation and sprint planning included.",a01895a4-833b-4e43-8649-cdbdde11a928,U05BJUUT44B,2025-12-11T21:57:35.313Z
1702985789.837709,Manu,Stacked Marketer - Brand Assets and Logo Variants,"Sharing this for reference for Stacked Marketer Pro <https://twitter.com/helloitsolly/status/1737055078987464847?t=vfb3PDFj9OgRxTZi3cbASQ&amp;s=1|https://twitter.com/helloitsolly/status/1737055078987464847>

Some good suggestions for alternatives to generic graphics, as I had mentioned to replace them.",refact-stackedmarketer,,"Discussion and coordination on obtaining and utilizing brand assets and logo variants for Stacked Marketer, including formats like .ai, .psd, and PNG for various uses.",baa63fc4-07d3-4bd2-9855-36886a90ffd8,U059AC59LLF,2025-12-11T21:04:56.093Z
1696390559.336719,Parnia,September Hours and Q4 Planning Acknowledgment,"Hi Manu,

Here is the hour breakdown for September. We've tracked 48 hours in total and we will transfer the remaining 102 hours to the upcoming months.

• Branding retouch 2.5h
• AutoPub Updates 21h
• Design: optimize the email template 2h
• Opening post in forum topic is hidden 3h
• Replace BBPress with a (better) alternative 3h
• Plugin Update 1.5h
• Email Preference Center 2h
• Import old Psychology of Marketing articles to WordPress 2.5h
• SM Pro subscribers email integration and segmentation 0.5h
• Bug: Scheduled post publishing does not work 3h
• Project management &amp; Meetings 7h",refact-stackedmarketer,,Discussion about the remaining hours for September and planning tasks for Q4 based on available hours.,379fffa6-385d-43b4-9333-4f12c0f08def,U039WK9NWA0,2025-12-11T21:57:51.024Z
1711319688.222859,Manu,Upcoming Content Widget Display Issue,"Two things that are still missing from what I can see, both important:
• Upcoming content only shows free content now so it’s broken, not just notifications for it are an issue. We must show at least the upcoming content as Coming Soon even if we cannot enable notifications right away. Otherwise, it looks too empty for what is coming up.
• Videos that were too big to upload because of the Cloudflare restriction. Needed before the end of the day tomorrow for us so we can prepare all courses for the launch.",refact-stackedmarketer,1711319688.222859,"Investigate and resolve the issue with the Upcoming Content widget not displaying all scheduled Pro content, including Pro Reports and courses. Ensure that free content does not appear in the widget as intended.",7e991451-13a8-4a07-b106-c02113873d4a,U059AC59LLF,2025-12-11T19:58:56.54Z
